subject;title;author_1;author_2;author_3;author_4;author_5;abstract
Computer Science > Artificial Intelligence;A Market-Oriented Programming Environment and its Application to Distributed Multicommodity Flow Problems;M. P. Wellman;;;;;"  Market price systems constitute a well-understood class of mechanisms that
under certain conditions provide effective decentralization of decision making
with minimal communication overhead. In a market-oriented programming approach
to distributed problem solving, we derive the activities and resource
allocations for a set of computational agents by computing the competitive
equilibrium of an artificial economy. WALRAS provides basic constructs for
defining computational market structures, and protocols for deriving their
corresponding price equilibria. In a particular realization of this approach
for a form of multicommodity flow problem, we see that careful construction of
the decision process according to economic principles can lead to efficient
distributed resource allocation, and that the behavior of the system can be
meaningfully analyzed in economic terms.

    "
Computer Science > Artificial Intelligence;Dynamic Backtracking;M. L. Ginsberg;;;;;"  Because of their occasional need to return to shallow points in a search
tree, existing backtracking methods can sometimes erase meaningful progress
toward solving a search problem. In this paper, we present a method by which
backtrack points can be moved deeper in the search space, thereby avoiding this
difficulty. The technique developed is a variant of dependency-directed
backtracking that uses only polynomial space while still providing useful
control information and retaining the completeness guarantees provided by
earlier approaches.

    "
Computer Science > Artificial Intelligence;Teleo-Reactive Programs for Agent Control;N. Nilsson;;;;;"  A formalism is presented for computing and organizing actions for autonomous
agents in dynamic environments. We introduce the notion of teleo-reactive (T-R)
programs whose execution entails the construction of circuitry for the
continuous computation of the parameters and conditions on which agent action
is based. In addition to continuous feedback, T-R programs support parameter
binding and recursion. A primary difference between T-R programs and many other
circuit-based systems is that the circuitry of T-R programs is more compact; it
is constructed at run time and thus does not have to anticipate all the
contingencies that might arise over all possible runs. In addition, T-R
programs are intuitive and easy to write and are written in a form that is
compatible with automatic planning and learning methods. We briefly describe
some experimental applications of T-R programs in the control of simulated and
actual mobile robots.

    "
Computer Science > Artificial Intelligence;Decidable Reasoning in Terminological Knowledge Representation Systems;M. Buchheit;F. M. Donini;A. Schaerf;;;"  Terminological knowledge representation systems (TKRSs) are tools for
designing and using knowledge bases that make use of terminological languages
(or concept languages). We analyze from a theoretical point of view a TKRS
whose capabilities go beyond the ones of presently available TKRSs. The new
features studied, often required in practical applications, can be summarized
in three main points. First, we consider a highly expressive terminological
language, called ALCNR, including general complements of concepts, number
restrictions and role conjunction. Second, we allow to express inclusion
statements between general concepts, and terminological cycles as a particular
case. Third, we prove the decidability of a number of desirable TKRS-deduction
services (like satisfiability, subsumption and instance checking) through a
sound, complete and terminating calculus for reasoning in ALCNR-knowledge
bases. Our calculus extends the general technique of constraint systems. As a
byproduct of the proof, we get also the result that inclusion statements in
ALCNR can be simulated by terminological cycles, if descriptive semantics is
adopted.

    "
Computer Science > Artificial Intelligence;Exploring the Decision Forest: An Empirical Investigation of Occam's Razor in Decision Tree Induction;P. M. Murphy;M. J. Pazzani;;;;"  We report on a series of experiments in which all decision trees consistent
with the training data are constructed. These experiments were run to gain an
understanding of the properties of the set of consistent decision trees and the
factors that affect the accuracy of individual trees. In particular, we
investigated the relationship between the size of a decision tree consistent
with some training data and the accuracy of the tree on test data. The
experiments were performed on a massively parallel Maspar computer. The results
of the experiments on several artificial and two real world problems indicate
that, for many of the problems investigated, smaller consistent decision trees
are on average less accurate than the average accuracy of slightly larger
trees.

    "
Computer Science > Artificial Intelligence;An Empirical Analysis of Search in GSAT;I. P. Gent;T. Walsh;;;;"  We describe an extensive study of search in GSAT, an approximation procedure
for propositional satisfiability. GSAT performs greedy hill-climbing on the
number of satisfied clauses in a truth assignment. Our experiments provide a
more complete picture of GSAT's search than previous accounts. We describe in
detail the two phases of search: rapid hill-climbing followed by a long plateau
search. We demonstrate that when applied to randomly generated 3SAT problems,
there is a very simple scaling with problem size for both the mean number of
satisfied clauses and the mean branching rate. Our results allow us to make
detailed numerical conjectures about the length of the hill-climbing phase, the
average gradient of this phase, and to conjecture that both the average score
and average branching rate decay exponentially during plateau search. We end by
showing how these results can be used to direct future theoretical analysis.
This work provides a case study of how computer experiments can be used to
improve understanding of the theoretical properties of algorithms.

    "
Computer Science > Artificial Intelligence;Bias-Driven Revision of Logical Domain Theories;M. Koppel;R. Feldman;A. M. Segre;;;"  The theory revision problem is the problem of how best to go about revising a
deficient domain theory using information contained in examples that expose
inaccuracies. In this paper we present our approach to the theory revision
problem for propositional domain theories. The approach described here, called
PTR, uses probabilities associated with domain theory elements to numerically
track the ``flow'' of proof through the theory. This allows us to measure the
precise role of a clause or literal in allowing or preventing a (desired or
undesired) derivation for a given example. This information is used to
efficiently locate and repair flawed elements of the theory. PTR is proved to
converge to a theory which correctly classifies all examples, and shown
experimentally to be fast and accurate even for deep theories.

    "
Computer Science > Artificial Intelligence;Substructure Discovery Using Minimum Description Length and Background Knowledge;D. J. Cook;L. B. Holder;;;;"  The ability to identify interesting and repetitive substructures is an
essential component to discovering knowledge in structural data. We describe a
new version of our SUBDUE substructure discovery system based on the minimum
description length principle. The SUBDUE system discovers substructures that
compress the original data and represent structural concepts in the data. By
replacing previously-discovered substructures in the data, multiple passes of
SUBDUE produce a hierarchical description of the structural regularities in the
data. SUBDUE uses a computationally-bounded inexact graph match that identifies
similar, but not identical, instances of a substructure and finds an
approximate measure of closeness of two substructures when under computational
constraints. In addition to the minimum description length principle, other
background knowledge can be used by SUBDUE to guide the search towards more
appropriate substructures. Experiments in a variety of domains demonstrate
SUBDUE's ability to find substructures capable of compressing the original data
and to discover structural concepts important to the domain. Description of
Online Appendix: This is a compressed tar file containing the SUBDUE discovery
system, written in C. The program accepts as input databases represented in
graph form, and will output discovered substructures with their corresponding
value.

    "
Computer Science > Artificial Intelligence;Learning the Past Tense of English Verbs: The Symbolic Pattern Associator vs. Connectionist Models;C. X. Ling;;;;;"  Learning the past tense of English verbs - a seemingly minor aspect of
language acquisition - has generated heated debates since 1986, and has become
a landmark task for testing the adequacy of cognitive modeling. Several
artificial neural networks (ANNs) have been implemented, and a challenge for
better symbolic models has been posed. In this paper, we present a
general-purpose Symbolic Pattern Associator (SPA) based upon the decision-tree
learning algorithm ID3. We conduct extensive head-to-head comparisons on the
generalization ability between ANN models and the SPA under different
representations. We conclude that the SPA generalizes the past tense of unseen
verbs better than ANN models by a wide margin, and we offer insights as to why
this should be the case. We also discuss a new default strategy for
decision-tree learning algorithms.

    "
Computer Science > Artificial Intelligence;A System for Induction of Oblique Decision Trees;S. K. Murthy;S. Kasif;S. Salzberg;;;"  This article describes a new system for induction of oblique decision trees.
This system, OC1, combines deterministic hill-climbing with two forms of
randomization to find a good oblique split (in the form of a hyperplane) at
each node of a decision tree. Oblique decision tree methods are tuned
especially for domains in which the attributes are numeric, although they can
be adapted to symbolic or mixed symbolic/numeric attributes. We present
extensive empirical studies, using both real and artificial data, that analyze
OC1's ability to construct oblique trees that are smaller and more accurate
than their axis-parallel counterparts. We also examine the benefits of
randomization for the construction of oblique decision trees.

    "
Computer Science > Artificial Intelligence;Pattern Matching and Discourse Processing in Information Extraction from Japanese Text;T. Kitani;Y. Eriguchi;M. Hara;;;"  Information extraction is the task of automatically picking up information of
interest from an unconstrained text. Information of interest is usually
extracted in two steps. First, sentence level processing locates relevant
pieces of information scattered throughout the text; second, discourse
processing merges coreferential information to generate the output. In the
first step, pieces of information are locally identified without recognizing
any relationships among them. A key word search or simple pattern search can
achieve this purpose. The second step requires deeper knowledge in order to
understand relationships among separately identified pieces of information.
Previous information extraction systems focused on the first step, partly
because they were not required to link up each piece of information with other
pieces. To link the extracted pieces of information and map them onto a
structured output format, complex discourse processing is essential. This paper
reports on a Japanese information extraction system that merges information
using a pattern matcher and discourse processor. Evaluation results show a high
level of system performance which approaches human performance.

    "
Computer Science > Artificial Intelligence;Total-Order and Partial-Order Planning: A Comparative Analysis;S. Minton;J. Bresina;M. Drummond;;;"  For many years, the intuitions underlying partial-order planning were largely
taken for granted. Only in the past few years has there been renewed interest
in the fundamental principles underlying this paradigm. In this paper, we
present a rigorous comparative analysis of partial-order and total-order
planning by focusing on two specific planners that can be directly compared. We
show that there are some subtle assumptions that underly the wide-spread
intuitions regarding the supposed efficiency of partial-order planning. For
instance, the superiority of partial-order planning can depend critically upon
the search strategy and the structure of the search space. Understanding the
underlying assumptions is crucial for constructing efficient planners.

    "
Computer Science > Artificial Intelligence;Operations for Learning with Graphical Models;W. L. Buntine;;;;;"  This paper is a multidisciplinary review of empirical, statistical learning
from a graphical model perspective. Well-known examples of graphical models
include Bayesian networks, directed graphs representing a Markov chain, and
undirected networks representing a Markov field. These graphical models are
extended to model data analysis and empirical learning using the notation of
plates. Graphical operations for simplifying and manipulating a problem are
provided including decomposition, differentiation, and the manipulation of
probability models from the exponential family. Two standard algorithm schemas
for learning are reviewed in a graphical framework: Gibbs sampling and the
expectation maximization algorithm. Using these operations and schemas, some
popular algorithms can be synthesized from their graphical specification. This
includes versions of linear regression, techniques for feed-forward networks,
and learning Gaussian and discrete Bayesian networks from data. The paper
concludes by sketching some implications for data analysis and summarizing how
some popular algorithms fall within the framework presented. The main original
contributions here are the decomposition techniques and the demonstration that
graphical models provide a framework for understanding and developing complex
learning algorithms.

    "
Computer Science > Artificial Intelligence;Applying GSAT to Non-Clausal Formulas;R. Sebastiani;;;;;"  In this paper we describe how to modify GSAT so that it can be applied to
non-clausal formulas. The idea is to use a particular ``score'' function which
gives the number of clauses of the CNF conversion of a formula which are false
under a given truth assignment. Its value is computed in linear time, without
constructing the CNF conversion itself. The proposed methodology applies to
most of the variants of GSAT proposed so far.

    "
Computer Science > Artificial Intelligence;Wrap-Up: a Trainable Discourse Module for Information Extraction;S. Soderland;Lehnert. W;;;;"  The vast amounts of on-line text now available have led to renewed interest
in information extraction (IE) systems that analyze unrestricted text,
producing a structured representation of selected information from the text.
This paper presents a novel approach that uses machine learning to acquire
knowledge for some of the higher level IE processing. Wrap-Up is a trainable IE
discourse component that makes intersentential inferences and identifies
logical relations among information extracted from the text. Previous
corpus-based approaches were limited to lower level processing such as
part-of-speech tagging, lexical disambiguation, and dictionary construction.
Wrap-Up is fully trainable, and not only automatically decides what classifiers
are needed, but even derives the feature set for each classifier automatically.
Performance equals that of a partially trainable discourse module requiring
manual customization for each domain.

    "
Computer Science > Artificial Intelligence;Truncating Temporal Differences: On the Efficient Implementation of TD(lambda) for Reinforcement Learning;P. Cichosz;;;;;"  Temporal difference (TD) methods constitute a class of methods for learning
predictions in multi-step prediction problems, parameterized by a recency
factor lambda. Currently the most important application of these methods is to
temporal credit assignment in reinforcement learning. Well known reinforcement
learning algorithms, such as AHC or Q-learning, may be viewed as instances of
TD learning. This paper examines the issues of the efficient and general
implementation of TD(lambda) for arbitrary lambda, for use with reinforcement
learning algorithms optimizing the discounted sum of rewards. The traditional
approach, based on eligibility traces, is argued to suffer from both
inefficiency and lack of generality. The TTD (Truncated Temporal Differences)
procedure is proposed as an alternative, that indeed only approximates
TD(lambda), but requires very little computation per action and can be used
with arbitrary function representation methods. The idea from which it is
derived is fairly simple and not new, but probably unexplored so far.
Encouraging experimental results are presented, suggesting that using lambda
&gt 0 with the TTD procedure allows one to obtain a significant learning
speedup at essentially the same cost as usual TD(0) learning.

    "
Computer Science > Artificial Intelligence;A Domain-Independent Algorithm for Plan Adaptation;S. Hanks;D. S. Weld;;;;"  The paradigms of transformational planning, case-based planning, and plan
debugging all involve a process known as plan adaptation - modifying or
repairing an old plan so it solves a new problem. In this paper we provide a
domain-independent algorithm for plan adaptation, demonstrate that it is sound,
complete, and systematic, and compare it to other adaptation algorithms in the
literature. Our approach is based on a view of planning as searching a graph of
partial plans. Generative planning starts at the graph's root and moves from
node to node using plan-refinement operators. In planning by adaptation, a
library plan - an arbitrary node in the plan graph - is the starting point for
the search, and the plan-adaptation algorithm can apply both the same
refinement operators available to a generative planner and can also retract
constraints and steps from the plan. Our algorithm's completeness ensures that
the adaptation algorithm will eventually search the entire graph and its
systematicity ensures that it will do so without redundantly searching any
parts of the graph.

    "
Computer Science > Artificial Intelligence;A Semantics and Complete Algorithm for Subsumption in the CLASSIC Description Logic;A. Borgida;P. F. Patel-Schneider;;;;"  This paper analyzes the correctness of the subsumption algorithm used in
CLASSIC, a description logic-based knowledge representation system that is
being used in practical applications. In order to deal efficiently with
individuals in CLASSIC descriptions, the developers have had to use an
algorithm that is incomplete with respect to the standard, model-theoretic
semantics for description logics. We provide a variant semantics for
descriptions with respect to which the current implementation is complete, and
which can be independently motivated. The soundness and completeness of the
polynomial-time subsumption algorithm is established using description graphs,
which are an abstracted version of the implementation structures used in
CLASSIC, and are of independent interest.

    "
Computer Science > Artificial Intelligence;Rerepresenting and Restructuring Domain Theories: A Constructive Induction Approach;S. K. Donoho;L. A. Rendell;;;;"  Theory revision integrates inductive learning and background knowledge by
combining training examples with a coarse domain theory to produce a more
accurate theory. There are two challenges that theory revision and other
theory-guided systems face. First, a representation language appropriate for
the initial theory may be inappropriate for an improved theory. While the
original representation may concisely express the initial theory, a more
accurate theory forced to use that same representation may be bulky,
cumbersome, and difficult to reach. Second, a theory structure suitable for a
coarse domain theory may be insufficient for a fine-tuned theory. Systems that
produce only small, local changes to a theory have limited value for
accomplishing complex structural alterations that may be required.
Consequently, advanced theory-guided learning systems require flexible
representation and flexible structure. An analysis of various theory revision
systems and theory-guided learning systems reveals specific strengths and
weaknesses in terms of these two desired properties. Designed to capture the
underlying qualities of each system, a new system uses theory-guided
constructive induction. Experiments in three domains show improvement over
previous theory-guided systems. This leads to a study of the behavior,
limitations, and potential of theory-guided constructive induction.

    "
Computer Science > Artificial Intelligence;Pac-learning Recursive Logic Programs: Negative Results;W. W. Cohen;;;;;"  In a companion paper it was shown that the class of constant-depth
determinate k-ary recursive clauses is efficiently learnable. In this paper we
present negative results showing that any natural generalization of this class
is hard to learn in Valiant's model of pac-learnability. In particular, we show
that the following program classes are cryptographically hard to learn:
programs with an unbounded number of constant-depth linear recursive clauses;
programs with one constant-depth determinate clause containing an unbounded
number of recursive calls; and programs with one linear recursive clause of
constant locality. These results immediately imply the non-learnability of any
more general class of programs. We also show that learning a constant-depth
determinate program with either two linear recursive clauses or one linear
recursive clause and one non-recursive clause is as hard as learning boolean
DNF. Together with positive results from the companion paper, these negative
results establish a boundary of efficient learnability for recursive
function-free clauses.

    "
Computer Science > Artificial Intelligence;Pac-Learning Recursive Logic Programs: Efficient Algorithms;W. W. Cohen;;;;;"  We present algorithms that learn certain classes of function-free recursive
logic programs in polynomial time from equivalence queries. In particular, we
show that a single k-ary recursive constant-depth determinate clause is
learnable. Two-clause programs consisting of one learnable recursive clause and
one constant-depth determinate non-recursive clause are also learnable, if an
additional ``basecase'' oracle is assumed. These results immediately imply the
pac-learnability of these classes. Although these classes of learnable
recursive programs are very constrained, it is shown in a companion paper that
they are maximally general, in that generalizing either class in any natural
way leads to a computationally difficult learning problem. Thus, taken together
with its companion paper, this paper establishes a boundary of efficient
learnability for recursive logic programs.

    "
Computer Science > Artificial Intelligence;Adaptive Load Balancing: A Study in Multi-Agent Learning;A. Schaerf;Y. Shoham;M. Tennenholtz;;;"  We study the process of multi-agent reinforcement learning in the context of
load balancing in a distributed system, without use of either central
coordination or explicit communication. We first define a precise framework in
which to study adaptive load balancing, important features of which are its
stochastic nature and the purely local information available to individual
agents. Given this framework, we show illuminating results on the interplay
between basic adaptive behavior parameters and their effect on system
efficiency. We then investigate the properties of adaptive load balancing in
heterogeneous populations, and address the issue of exploration vs.
exploitation in that context. Finally, we show that naive use of communication
may not improve, and might even harm system efficiency.

    "
Computer Science > Artificial Intelligence;Cost-Sensitive Classification: Empirical Evaluation of a Hybrid Genetic Decision Tree Induction Algorithm;P. D. Turney;;;;;"  This paper introduces ICET, a new algorithm for cost-sensitive
classification. ICET uses a genetic algorithm to evolve a population of biases
for a decision tree induction algorithm. The fitness function of the genetic
algorithm is the average cost of classification when using the decision tree,
including both the costs of tests (features, measurements) and the costs of
classification errors. ICET is compared here with three other algorithms for
cost-sensitive classification - EG2, CS-ID3, and IDX - and also with C4.5,
which classifies without regard to cost. The five algorithms are evaluated
empirically on five real-world medical datasets. Three sets of experiments are
performed. The first set examines the baseline performance of the five
algorithms on the five datasets and establishes that ICET performs
significantly better than its competitors. The second set tests the robustness
of ICET under a variety of conditions and shows that ICET maintains its
advantage. The third set looks at ICET's search in bias space and discovers a
way to improve the search.

    "
