subject;title;author_1;author_2;author_3;author_4;author_5;abstract
Computer Science > Artificial Intelligence;Using Pivot Consistency to Decompose and Solve Functional CSPs;P. David;;;;;"  Many studies have been carried out in order to increase the search efficiency
of constraint satisfaction problems; among them, some make use of structural
properties of the constraint network; others take into account semantic
properties of the constraints, generally assuming that all the constraints
possess the given property. In this paper, we propose a new decomposition
method benefiting from both semantic properties of functional constraints (not
bijective constraints) and structural properties of the network; furthermore,
not all the constraints need to be functional. We show that under some
conditions, the existence of solutions can be guaranteed. We first characterize
a particular subset of the variables, which we name a root set. We then
introduce pivot consistency, a new local consistency which is a weak form of
path consistency and can be achieved in O(n^2d^2) complexity (instead of
O(n^3d^3) for path consistency), and we present associated properties; in
particular, we show that any consistent instantiation of the root set can be
linearly extended to a solution, which leads to the presentation of the
aforementioned new method for solving by decomposing functional CSPs.

    "
Computer Science > Artificial Intelligence;Provably Bounded-Optimal Agents;S. J. Russell;D. Subramanian;;;;"  Since its inception, artificial intelligence has relied upon a theoretical
foundation centered around perfect rationality as the desired property of
intelligent systems. We argue, as others have done, that this foundation is
inadequate because it imposes fundamentally unsatisfiable requirements. As a
result, there has arisen a wide gap between theory and practice in AI,
hindering progress in the field. We propose instead a property called bounded
optimality. Roughly speaking, an agent is bounded-optimal if its program is a
solution to the constrained optimization problem presented by its architecture
and the task environment. We show how to construct agents with this property
for a simple class of machine architectures in a broad class of real-time
environments. We illustrate these results using a simple model of an automated
mail sorting facility. We also define a weaker property, asymptotic bounded
optimality (ABO), that generalizes the notion of optimality in classical
complexity theory. We then construct universal ABO programs, i.e., programs
that are ABO no matter what real-time constraints are applied. Universal ABO
programs can be used as building blocks for more complex systems. We conclude
with a discussion of the prospects for bounded optimality as a theoretical
basis for AI, and relate it to similar trends in philosophy, economics, and
game theory.

    "
Computer Science > Artificial Intelligence;On the Informativeness of the DNA Promoter Sequences Domain Theory;J. Ortega;;;;;"  The DNA promoter sequences domain theory and database have become popular for
testing systems that integrate empirical and analytical learning. This note
reports a simple change and reinterpretation of the domain theory in terms of
M-of-N concepts, involving no learning, that results in an accuracy of 93.4% on
the 106 items of the database. Moreover, an exhaustive search of the space of
M-of-N domain theory interpretations indicates that the expected accuracy of a
randomly chosen interpretation is 76.5%, and that a maximum accuracy of 97.2%
is achieved in 12 cases. This demonstrates the informativeness of the domain
theory, without the complications of understanding the interactions between
various learning algorithms and the theory. In addition, our results help
characterize the difficulty of learning using the DNA promoters theory.

    "
Computer Science > Artificial Intelligence;Solving Multiclass Learning Problems via Error-Correcting Output Codes;T. G. Dietterich;G. Bakiri;;;;"  Multiclass learning problems involve finding a definition for an unknown
function f(x) whose range is a discrete set containing k &gt 2 values (i.e., k
``classes''). The definition is acquired by studying collections of training
examples of the form [x_i, f (x_i)]. Existing approaches to multiclass learning
problems include direct application of multiclass algorithms such as the
decision-tree algorithms C4.5 and CART, application of binary concept learning
algorithms to learn individual binary functions for each of the k classes, and
application of binary concept learning algorithms with distributed output
representations. This paper compares these three approaches to a new technique
in which error-correcting codes are employed as a distributed output
representation. We show that these output representations improve the
generalization performance of both C4.5 and backpropagation on a wide range of
multiclass learning tasks. We also demonstrate that this approach is robust
with respect to changes in the size of the training sample, the assignment of
distributed representations to particular classes, and the application of
overfitting avoidance techniques such as decision-tree pruning. Finally, we
show that---like the other methods---the error-correcting code technique can
provide reliable class probability estimates. Taken together, these results
demonstrate that error-correcting output codes provide a general-purpose method
for improving the performance of inductive learning programs on multiclass
problems.

    "
Computer Science > Artificial Intelligence;Random Worlds and Maximum Entropy;A. J. Grove;J. Y. Halpern;D. Koller;;;"  Given a knowledge base KB containing first-order and statistical facts, we
consider a principled method, called the random-worlds method, for computing a
degree of belief that some formula Phi holds given KB. If we are reasoning
about a world or system consisting of N individuals, then we can consider all
possible worlds, or first-order models, with domain {1,...,N} that satisfy KB,
and compute the fraction of them in which Phi is true. We define the degree of
belief to be the asymptotic value of this fraction as N grows large. We show
that when the vocabulary underlying Phi and KB uses constants and unary
predicates only, we can naturally associate an entropy with each world. As N
grows larger, there are many more worlds with higher entropy. Therefore, we can
use a maximum-entropy computation to compute the degree of belief. This result
is in a similar spirit to previous work in physics and artificial intelligence,
but is far more general. Of equal interest to the result itself are the
limitations on its scope. Most importantly, the restriction to unary predicates
seems necessary. Although the random-worlds method makes sense in general, the
connection to maximum entropy seems to disappear in the non-unary case. These
observations suggest unexpected limitations to the applicability of
maximum-entropy methods.

    "
Computer Science > Artificial Intelligence;On Planning while Learning;S. Safra;M. Tennenholtz;;;;"  This paper introduces a framework for Planning while Learning where an agent
is given a goal to achieve in an environment whose behavior is only partially
known to the agent. We discuss the tractability of various plan-design
processes. We show that for a large natural class of Planning while Learning
systems, a plan can be presented and verified in a reasonable time. However,
coming up algorithmically with a plan, even for simple classes of systems is
apparently intractable. We emphasize the role of off-line plan-design
processes, and show that, in most natural cases, the verification (projection)
part can be carried out in an efficient algorithmic manner.

    "
Computer Science > Artificial Intelligence;Software Agents: Completing Patterns and Constructing User Interfaces;J. C. Schlimmer;L. A. Hermens;;;;"  To support the goal of allowing users to record and retrieve information,
this paper describes an interactive note-taking system for pen-based computers
with two distinctive features. First, it actively predicts what the user is
going to write. Second, it automatically constructs a custom, button-box user
interface on request. The system is an example of a learning-apprentice
software- agent. A machine learning component characterizes the syntax and
semantics of the user's information. A performance system uses this learned
information to generate completion strings and construct a user interface.
Description of Online Appendix: People like to record information. Doing this
on paper is initially efficient, but lacks flexibility. Recording information
on a computer is less efficient but more powerful. In our new note taking
softwre, the user records information directly on a computer. Behind the
interface, an agent acts for the user. To help, it provides defaults and
constructs a custom user interface. The demonstration is a QuickTime movie of
the note taking agent in action. The file is a binhexed self-extracting
archive. Macintosh utilities for binhex are available from
"
Computer Science > Artificial Intelligence;The Difficulties of Learning Logic Programs with Cut;F. Bergadano;D. Gunetti;U. Trinchero;;;"  As real logic programmers normally use cut (!), an effective learning
procedure for logic programs should be able to deal with it. Because the cut
predicate has only a procedural meaning, clauses containing cut cannot be
learned using an extensional evaluation method, as is done in most learning
systems. On the other hand, searching a space of possible programs (instead of
a space of independent clauses) is unfeasible. An alternative solution is to
generate first a candidate base program which covers the positive examples, and
then make it consistent by inserting cut where appropriate. The problem of
learning programs with cut has not been investigated before and this seems to
be a natural and reasonable approach. We generalize this scheme and investigate
the difficulties that arise. Some of the major shortcomings are actually
caused, in general, by the need for intensional evaluation. As a conclusion,
the analysis of this paper suggests, on precise and technical grounds, that
learning cut is difficult, and current induction techniques should probably be
restricted to purely declarative logic languages.

    "
Computer Science > Artificial Intelligence;An Integrated Framework for Learning and Reasoning;C. G. Giraud-Carrier;T. R. Martinez;;;;"  Learning and reasoning are both aspects of what is considered to be
intelligence. Their studies within AI have been separated historically,
learning being the topic of machine learning and neural networks, and reasoning
falling under classical (or symbolic) AI. However, learning and reasoning are
in many ways interdependent. This paper discusses the nature of some of these
interdependencies and proposes a general framework called FLARE, that combines
inductive learning using prior knowledge together with reasoning in a
propositional setting. Several examples that test the framework are presented,
including classical induction, many important reasoning protocols and two
simple expert systems.

    "
Computer Science > Artificial Intelligence;Building and Refining Abstract Planning Cases by Change of Representation Language;R. Bergmann;W. Wilke;;;;"  ion is one of the most promising approaches to improve the performance of
problem solvers. In several domains abstraction by dropping sentences of a
domain description -- as used in most hierarchical planners -- has proven
useful. In this paper we present examples which illustrate significant
drawbacks of abstraction by dropping sentences. To overcome these drawbacks, we
propose a more general view of abstraction involving the change of
representation language. We have developed a new abstraction methodology and a
related sound and complete learning algorithm that allows the complete change
of representation language of planning cases from concrete to abstract.
However, to achieve a powerful change of the representation language, the
abstract language itself as well as rules which describe admissible ways of
abstracting states must be provided in the domain model. This new abstraction
approach is the core of Paris (Plan Abstraction and Refinement in an Integrated
System), a system in which abstract planning cases are automatically learned
from given concrete cases. An empirical study in the domain of process planning
in mechanical engineering shows significant advantages of the proposed
reasoning from abstract cases over classical hierarchical planning.

    "
Computer Science > Artificial Intelligence;Using Qualitative Hypotheses to Identify Inaccurate Data;Q. Zhao;T. Nishida;;;;"  Identifying inaccurate data has long been regarded as a significant and
difficult problem in AI. In this paper, we present a new method for identifying
inaccurate data on the basis of qualitative correlations among related data.
First, we introduce the definitions of related data and qualitative
correlations among related data. Then we put forward a new concept called
support coefficient function (SCF). SCF can be used to extract, represent, and
calculate qualitative correlations among related data within a dataset. We
propose an approach to determining dynamic shift intervals of inaccurate data,
and an approach to calculating possibility of identifying inaccurate data,
respectively. Both of the approaches are based on SCF. Finally we present an
algorithm for identifying inaccurate data by using qualitative correlations
among related data as confirmatory or disconfirmatory evidence. We have
developed a practical system for interpreting infrared spectra by applying the
method, and have fully tested the system against several hundred real spectra.
The experimental results show that the method is significantly better than the
conventional methods used in many similar systems.

    "
Computer Science > Artificial Intelligence;Flexibly Instructable Agents;S. B. Huffman;J. E. Laird;;;;"  This paper presents an approach to learning from situated, interactive
tutorial instruction within an ongoing agent. Tutorial instruction is a
flexible (and thus powerful) paradigm for teaching tasks because it allows an
instructor to communicate whatever types of knowledge an agent might need in
whatever situations might arise. To support this flexibility, however, the
agent must be able to learn multiple kinds of knowledge from a broad range of
instructional interactions. Our approach, called situated explanation, achieves
such learning through a combination of analytic and inductive techniques. It
combines a form of explanation-based learning that is situated for each
instruction with a full suite of contextually guided responses to incomplete
explanations. The approach is implemented in an agent called Instructo-Soar
that learns hierarchies of new tasks and other domain knowledge from
interactive natural language instructions. Instructo-Soar meets three key
requirements of flexible instructability that distinguish it from previous
systems: (1) it can take known or unknown commands at any instruction point;
(2) it can handle instructions that apply to either its current situation or to
a hypothetical situation specified in language (as in, for instance,
conditional instructions); and (3) it can learn, from instructions, each class
of knowledge it uses to perform tasks.

    "
Computer Science > Artificial Intelligence;Learning Membership Functions in a Function-Based Object Recognition System;K. Woods;D. Cook;L. Hall;K. Bowyer;L. Stark;"  Functionality-based recognition systems recognize objects at the category
level by reasoning about how well the objects support the expected function.
Such systems naturally associate a ``measure of goodness'' or ``membership
value'' with a recognized object. This measure of goodness is the result of
combining individual measures, or membership values, from potentially many
primitive evaluations of different properties of the object's shape. A
membership function is used to compute the membership value when evaluating a
primitive of a particular physical property of an object. In previous versions
of a recognition system known as Gruff, the membership function for each of the
primitive evaluations was hand-crafted by the system designer. In this paper,
we provide a learning component for the Gruff system, called Omlet, that
automatically learns membership functions given a set of example objects
labeled with their desired category measure. The learning algorithm is
generally applicable to any problem in which low-level membership values are
combined through an and-or tree structure to give a final overall membership
value.

    "
Computer Science > Artificial Intelligence;Rule-based Machine Learning Methods for Functional Prediction;S. M. Weiss;N. Indurkhya;;;;"  We describe a machine learning method for predicting the value of a
real-valued function, given the values of multiple input variables. The method
induces solutions from samples in the form of ordered disjunctive normal form
(DNF) decision rules. A central objective of the method and representation is
the induction of compact, easily interpretable solutions. This rule-based
decision model can be extended to search efficiently for similar cases prior to
approximating function values. Experimental results on real-world data
demonstrate that the new techniques are competitive with existing machine
learning and statistical methods and can sometimes yield superior regression
performance.

    "
Computer Science > Artificial Intelligence;Statistical Feature Combination for the Evaluation of Game Positions;M. Buro;;;;;"  This article describes an application of three well-known statistical methods
in the field of game-tree search: using a large number of classified Othello
positions, feature weights for evaluation functions with a
game-phase-independent meaning are estimated by means of logistic regression,
Fisher's linear discriminant, and the quadratic discriminant function for
normally distributed features. Thereafter, the playing strengths are compared
by means of tournaments between the resulting versions of a world-class Othello
program. In this application, logistic regression - which is used here for the
first time in the context of game playing - leads to better results than the
other approaches.

    "
Computer Science > Artificial Intelligence;Translating between Horn Representations and their Characteristic Models;R. Khardon;;;;;"  Characteristic models are an alternative, model based, representation for
Horn expressions. It has been shown that these two representations are
incomparable and each has its advantages over the other. It is therefore
natural to ask what is the cost of translating, back and forth, between these
representations. Interestingly, the same translation questions arise in
database theory, where it has applications to the design of relational
databases. This paper studies the computational complexity of these problems.
Our main result is that the two translation problems are equivalent under
polynomial reductions, and that they are equivalent to the corresponding
decision problem. Namely, translating is equivalent to deciding whether a given
set of models is the set of characteristic models for a given Horn expression.
We also relate these problems to the hypergraph transversal problem, a well
known problem which is related to other applications in AI and for which no
polynomial time algorithm is known. It is shown that in general our translation
problems are at least as hard as the hypergraph transversal problem, and in a
special case they are equivalent to it.

    "
Computer Science > Artificial Intelligence;Iterative Optimization and Simplification of Hierarchical Clusterings;D. Fisher;;;;;"  Clustering is often used for discovering structure in data. Clustering
systems differ in the objective function used to evaluate clustering quality
and the control strategy used to search the space of clusterings. Ideally, the
search strategy should consistently construct clusterings of high quality, but
be computationally inexpensive as well. In general, we cannot have it both
ways, but we can partition the search so that a system inexpensively constructs
a `tentative' clustering for initial examination, followed by iterative
optimization, which continues to search in background for improved clusterings.
Given this motivation, we evaluate an inexpensive strategy for creating initial
clusterings, coupled with several control strategies for iterative
optimization, each of which repeatedly modifies an initial clustering in search
of a better one. One of these methods appears novel as an iterative
optimization strategy in clustering contexts. Once a clustering has been
constructed it is judged by analysts -- often according to task-specific
criteria. Several authors have abstracted these criteria and posited a generic
performance task akin to pattern completion, where the error rate over
completed patterns is used to `externally' judge clustering utility. Given this
performance task, we adapt resampling-based pruning strategies used by
supervised learning systems to the task of simplifying hierarchical
clusterings, thus promising to ease post-clustering analysis. Finally, we
propose a number of objective functions, based on attribute-selection measures
for decision-tree induction, that might perform well on the error rate and
simplicity dimensions.

    "
Computer Science > Artificial Intelligence;2Planning for Contingencies: A Decision-based Approach;L. Pryor;G. Collins;;;;"  A fundamental assumption made by classical AI planners is that there is no
uncertainty in the world: the planner has full knowledge of the conditions
under which the plan will be executed and the outcome of every action is fully
predictable. These planners cannot therefore construct contingency plans, i.e.,
plans in which different actions are performed in different circumstances. In
this paper we discuss some issues that arise in the representation and
construction of contingency plans and describe Cassandra, a partial-order
contingency planner. Cassandra uses explicit decision-steps that enable the
agent executing the plan to decide which plan branch to follow. The
decision-steps in a plan result in subgoals to acquire knowledge, which are
planned for in the same way as any other subgoals. Cassandra thus distinguishes
the process of gathering information from the process of making decisions. The
explicit representation of decisions in Cassandra allows a coherent approach to
the problems of contingent planning, and provides a solid base for extensions
such as the use of different decision-making procedures.

    "
Computer Science > Artificial Intelligence;A Formal Framework for Speedup Learning from Problems and Solutions;P. Tadepalli;B. K. Natarajan;;;;"  Speedup learning seeks to improve the computational efficiency of problem
solving with experience. In this paper, we develop a formal framework for
learning efficient problem solving from random problems and their solutions. We
apply this framework to two different representations of learned knowledge,
namely control rules and macro-operators, and prove theorems that identify
sufficient conditions for learning in each representation. Our proofs are
constructive in that they are accompanied with learning algorithms. Our
framework captures both empirical and explanation-based speedup learning in a
unified fashion. We illustrate our framework with implementations in two
domains: symbolic integration and Eight Puzzle. This work integrates many
strands of experimental and theoretical work in machine learning, including
empirical learning of control rules, macro-operator learning, Explanation-Based
Learning (EBL), and Probably Approximately Correct (PAC) Learning.

    "
Computer Science > Artificial Intelligence;A Principled Approach Towards Symbolic Geometric Constraint Satisfaction;S. Bhansali;G. A. Kramer;T. J. Hoar;;;"  An important problem in geometric reasoning is to find the configuration of a
collection of geometric bodies so as to satisfy a set of given constraints.
Recently, it has been suggested that this problem can be solved efficiently by
symbolically reasoning about geometry. This approach, called degrees of freedom
analysis, employs a set of specialized routines called plan fragments that
specify how to change the configuration of a set of bodies to satisfy a new
constraint while preserving existing constraints. A potential drawback, which
limits the scalability of this approach, is concerned with the difficulty of
writing plan fragments. In this paper we address this limitation by showing how
these plan fragments can be automatically synthesized using first principles
about geometric bodies, actions, and topology.

    "
