subject;title;author_1;author_2;author_3;author_4;author_5;abstract
Computer Science > Artificial Intelligence;Generalization of Clauses under Implication;P. Idestam-Almquist;;;;;"  In the area of inductive learning, generalization is a main operation, and
the usual definition of induction is based on logical implication. Recently
there has been a rising interest in clausal representation of knowledge in
machine learning. Almost all inductive learning systems that perform
generalization of clauses use the relation theta-subsumption instead of
implication. The main reason is that there is a well-known and simple technique
to compute least general generalizations under theta-subsumption, but not under
implication. However generalization under theta-subsumption is inappropriate
for learning recursive clauses, which is a crucial problem since recursion is
the basic program structure of logic programs. We note that implication between
clauses is undecidable, and we therefore introduce a stronger form of
implication, called T-implication, which is decidable between clauses. We show
that for every finite set of clauses there exists a least general
generalization under T-implication. We describe a technique to reduce
generalizations under implication of a clause to generalizations under
theta-subsumption of what we call an expansion of the original clause. Moreover
we show that for every non-tautological clause there exists a T-complete
expansion, which means that every generalization under T-implication of the
clause is reduced to a generalization under theta-subsumption of the expansion.

    "
Computer Science > Artificial Intelligence;Decision-Theoretic Foundations for Causal Reasoning;D. Heckerman;R. Shachter;;;;"  We present a definition of cause and effect in terms of decision-theoretic
primitives and thereby provide a principled foundation for causal reasoning.
Our definition departs from the traditional view of causation in that causal
assertions may vary with the set of decisions available. We argue that this
approach provides added clarity to the notion of cause. Also in this paper, we
examine the encoding of causal relationships in directed acyclic graphs. We
describe a special class of influence diagrams, those in canonical form, and
show its relationship to Pearl's representation of cause and effect. Finally,
we show how canonical form facilitates counterfactual reasoning.

    "
Computer Science > Artificial Intelligence;The Design and Experimental Analysis of Algorithms for Temporal Reasoning;P. vanBeek;D. W. Manchak;;;;"  Many applications -- from planning and scheduling to problems in molecular
biology -- rely heavily on a temporal reasoning component. In this paper, we
discuss the design and empirical analysis of algorithms for a temporal
reasoning system based on Allen's influential interval-based framework for
representing temporal information. At the core of the system are algorithms for
determining whether the temporal information is consistent, and, if so, finding
one or more scenarios that are consistent with the temporal information. Two
important algorithms for these tasks are a path consistency algorithm and a
backtracking algorithm. For the path consistency algorithm, we develop
techniques that can result in up to a ten-fold speedup over an already highly
optimized implementation. For the backtracking algorithm, we develop variable
and value ordering heuristics that are shown empirically to dramatically
improve the performance of the algorithm. As well, we show that a previously
suggested reformulation of the backtracking search problem can reduce the time
and space requirements of the backtracking search. Taken together, the
techniques we develop allow a temporal reasoning component to solve problems
that are of practical size.

    "
Computer Science > Artificial Intelligence;OPUS: An Efficient Admissible Algorithm for Unordered Search;G. I. Webb;;;;;"  OPUS is a branch and bound search algorithm that enables efficient admissible
search through spaces for which the order of search operator application is not
significant. The algorithm's search efficiency is demonstrated with respect to
very large machine learning search spaces. The use of admissible search is of
potential value to the machine learning community as it means that the exact
learning biases to be employed for complex learning tasks can be precisely
specified and manipulated. OPUS also has potential for application in other
areas of artificial intelligence, notably, truth maintenance.

    "
Computer Science > Artificial Intelligence;Vision-Based Road Detection in Automotive Systems: A Real-Time Expectation-Driven Approach;A. Broggi;S. Berte;;;;"  The main aim of this work is the development of a vision-based road detection
system fast enough to cope with the difficult real-time constraints imposed by
moving vehicle applications. The hardware platform, a special-purpose massively
parallel system, has been chosen to minimize system production and operational
costs. This paper presents a novel approach to expectation-driven low-level
image segmentation, which can be mapped naturally onto mesh-connected massively
parallel SIMD architectures capable of handling hierarchical data structures.
The input image is assumed to contain a distorted version of a given template;
a multiresolution stretching process is used to reshape the original template
in accordance with the acquired image content, minimizing a potential function.
The distorted template is the process output.

    "
Computer Science > Artificial Intelligence;Improving Connectionist Energy Minimization;G. Pinkas;R. Dechter;;;;"  Symmetric networks designed for energy minimization such as Boltzman machines
and Hopfield nets are frequently investigated for use in optimization,
constraint satisfaction and approximation of NP-hard problems. Nevertheless,
finding a global solution (i.e., a global minimum for the energy function) is
not guaranteed and even a local solution may take an exponential number of
steps. We propose an improvement to the standard local activation function used
for such networks. The improved algorithm guarantees that a global minimum is
found in linear time for tree-like subnetworks. The algorithm, called activate,
is uniform and does not assume that the network is tree-like. It can identify
tree-like subnetworks even in cyclic topologies (arbitrary networks) and avoid
local minima along these trees. For acyclic networks, the algorithm is
guaranteed to converge to a global minimum from any initial state of the system
(self-stabilization) and remains correct under various types of schedulers. On
the negative side, we show that in the presence of cycles, no uniform algorithm
exists that guarantees optimality even under a sequential asynchronous
scheduler. An asynchronous scheduler can activate only one unit at a time while
a synchronous scheduler can activate any number of units in a single time step.
In addition, no uniform algorithm exists to optimize even acyclic networks when
the scheduler is synchronous. Finally, we show how the algorithm can be
improved using the cycle-cutset scheme. The general algorithm, called
activate-with-cutset, improves over activate and has some performance
guarantees that are related to the size of the network's cycle-cutset.

    "
Computer Science > Artificial Intelligence;Diffusion of Context and Credit Information in Markovian Models;Y. Bengio;P. Frasconi;;;;"  This paper studies the problem of ergodicity of transition probability
matrices in Markovian models, such as hidden Markov models (HMMs), and how it
makes very difficult the task of learning to represent long-term context for
sequential data. This phenomenon hurts the forward propagation of long-term
context information, as well as learning a hidden state representation to
represent long-term context, which depends on propagating credit information
backwards in time. Using results from Markov chain theory, we show that this
problem of diffusion of context and credit is reduced when the transition
probabilities approach 0 or 1, i.e., the transition probability matrices are
sparse and the model essentially deterministic. The results found in this paper
apply to learning approaches based on continuous optimization, such as gradient
descent and the Baum-Welch algorithm.

    "
Computer Science > Artificial Intelligence;Induction of First-Order Decision Lists: Results on Learning the Past Tense of English Verbs;R. J. Mooney;M. E. Califf;;;;"  This paper presents a method for inducing logic programs from examples that
learns a new class of concepts called first-order decision lists, defined as
ordered lists of clauses each ending in a cut. The method, called FOIDL, is
based on FOIL (Quinlan, 1990) but employs intensional background knowledge and
avoids the need for explicit negative examples. It is particularly useful for
problems that involve rules with specific exceptions, such as learning the
past-tense of English verbs, a task widely studied in the context of the
symbolic/connectionist debate. FOIDL is able to learn concise, accurate
programs for this problem from significantly fewer examples than previous
methods (both connectionist and symbolic).

    "
Computer Science > Artificial Intelligence;FLECS: Planning with a Flexible Commitment Strategy;M. Veloso;P. Stone;;;;"  There has been evidence that least-commitment planners can efficiently handle
planning problems that involve difficult goal interactions. This evidence has
led to the common belief that delayed-commitment is the ""best"" possible
planning strategy. However, we recently found evidence that eager-commitment
planners can handle a variety of planning problems more efficiently, in
particular those with difficult operator choices. Resigned to the futility of
trying to find a universally successful planning strategy, we devised a planner
that can be used to study which domains and problems are best for which
planning strategies. In this article we introduce this new planning algorithm,
FLECS, which uses a FLExible Commitment Strategy with respect to plan-step
orderings. It is able to use any strategy from delayed-commitment to
eager-commitment. The combination of delayed and eager operator-ordering
commitments allows FLECS to take advantage of the benefits of explicitly using
a simulated execution state and reasoning about planning constraints. FLECS can
vary its commitment strategy across different problems and domains, and also
during the course of a single planning problem. FLECS represents a novel
contribution to planning in that it explicitly provides the choice of which
commitment strategy to use while planning. FLECS provides a framework to
investigate the mapping from planning domains and problems to efficient
planning strategies.

    "
Computer Science > Artificial Intelligence;SCREEN: Learning a Flat Syntactic and Semantic Spoken Language Analysis Using Artificial Neural Networks;S. Wermter;V. Weber;;;;"  Previous approaches of analyzing spontaneously spoken language often have
been based on encoding syntactic and semantic knowledge manually and
symbolically. While there has been some progress using statistical or
connectionist language models, many current spoken- language systems still use
a relatively brittle, hand-coded symbolic grammar or symbolic semantic
component. In contrast, we describe a so-called screening approach for learning
robust processing of spontaneously spoken language. A screening approach is a
flat analysis which uses shallow sequences of category representations for
analyzing an utterance at various syntactic, semantic and dialog levels. Rather
than using a deeply structured symbolic analysis, we use a flat connectionist
analysis. This screening approach aims at supporting speech and language
processing by using (1) data-driven learning and (2) robustness of
connectionist networks. In order to test this approach, we have developed the
SCREEN system which is based on this new robust, learned and flat analysis. In
this paper, we focus on a detailed description of SCREEN's architecture, the
flat syntactic and semantic analysis, the interaction with a speech recognizer,
and a detailed evaluation analysis of the robustness under the influence of
noisy or incomplete input. The main result of this paper is that flat
representations allow more robust processing of spontaneous spoken language
than deeply structured representations. In particular, we show how the
fault-tolerance and learning capability of connectionist networks can support a
flat analysis for providing more robust spoken-language processing within an
overall hybrid symbolic/connectionist framework.

    "
Computer Science > Artificial Intelligence;Improved Heterogeneous Distance Functions;D. R. Wilson;T. R. Martinez;;;;"  Instance-based learning techniques typically handle continuous and linear
input values well, but often do not handle nominal input attributes
appropriately. The Value Difference Metric (VDM) was designed to find
reasonable distance values between nominal attribute values, but it largely
ignores continuous attributes, requiring discretization to map continuous
values into nominal values. This paper proposes three new heterogeneous
distance functions, called the Heterogeneous Value Difference Metric (HVDM),
the Interpolated Value Difference Metric (IVDM), and the Windowed Value
Difference Metric (WVDM). These new distance functions are designed to handle
applications with nominal attributes, continuous attributes, or both. In
experiments on 48 applications the new distance metrics achieve higher
classification accuracy on average than three previous distance functions on
those datasets that have both nominal and continuous attributes.

    "
