subject;title;author_1;author_2;author_3;author_4;author_5;abstract
Computer Science > Artificial Intelligence;On Partially Controlled Multi-Agent Systems;R. I. Brafman;M. Tennenholtz;;;;"  Motivated by the control theoretic distinction between controllable and
uncontrollable events, we distinguish between two types of agents within a
multi-agent system: controllable agents, which are directly controlled by the
system's designer, and uncontrollable agents, which are not under the
designer's direct control. We refer to such systems as partially controlled
multi-agent systems, and we investigate how one might influence the behavior of
the uncontrolled agents through appropriate design of the controlled agents. In
particular, we wish to understand which problems are naturally described in
these terms, what methods can be applied to influence the uncontrollable
agents, the effectiveness of such methods, and whether similar methods work
across different domains. Using a game-theoretic framework, this paper studies
the design of partially controlled multi-agent systems in two contexts: in one
context, the uncontrollable agents are expected utility maximizers, while in
the other they are reinforcement learners. We suggest different techniques for
controlling agents' behavior in each domain, assess their success, and examine
their relationship.

    "
Computer Science > Artificial Intelligence;A Hierarchy of Tractable Subsets for Computing Stable Models;R. Ben-Eliyahu;;;;;"  Finding the stable models of a knowledge base is a significant computational
problem in artificial intelligence. This task is at the computational heart of
truth maintenance systems, autoepistemic logic, and default logic.
Unfortunately, it is NP-hard. In this paper we present a hierarchy of classes
of knowledge bases, Omega_1,Omega_2,..., with the following properties: first,
Omega_1 is the class of all stratified knowledge bases; second, if a knowledge
base Pi is in Omega_k, then Pi has at most k stable models, and all of them may
be found in time O(lnk), where l is the length of the knowledge base and n the
number of atoms in Pi; third, for an arbitrary knowledge base Pi, we can find
the minimum k such that Pi belongs to Omega_k in time polynomial in the size of
Pi; and, last, where K is the class of all knowledge bases, it is the case that
union{i=1 to infty} Omega_i = K, that is, every knowledge base belongs to some
class in the hierarchy.

    "
Computer Science > Artificial Intelligence;Spatial Aggregation: Theory and Applications;K. Yip;F. Zhao;;;;"  Visual thinking plays an important role in scientific reasoning. Based on the
research in automating diverse reasoning tasks about dynamical systems,
nonlinear controllers, kinematic mechanisms, and fluid motion, we have
identified a style of visual thinking, imagistic reasoning. Imagistic reasoning
organizes computations around image-like, analogue representations so that
perceptual and symbolic operations can be brought to bear to infer structure
and behavior. Programs incorporating imagistic reasoning have been shown to
perform at an expert level in domains that defy current analytic or numerical
methods. We have developed a computational paradigm, spatial aggregation, to
unify the description of a class of imagistic problem solvers. A program
written in this paradigm has the following properties. It takes a continuous
field and optional objective functions as input, and produces high-level
descriptions of structure, behavior, or control actions. It computes a
multi-layer of intermediate representations, called spatial aggregates, by
forming equivalence classes and adjacency relations. It employs a small set of
generic operators such as aggregation, classification, and localization to
perform bidirectional mapping between the information-rich field and
successively more abstract spatial aggregates. It uses a data structure, the
neighborhood graph, as a common interface to modularize computations. To
illustrate our theory, we describe the computational structure of three
implemented problem solvers -- KAM, MAPS, and HIPAIR --- in terms of the
spatial aggregation generic operators by mixing and matching a library of
commonly used routines.

    "
Computer Science > Artificial Intelligence;Cue Phrase Classification Using Machine Learning;D. J. Litman;;;;;"  Cue phrases may be used in a discourse sense to explicitly signal discourse
structure, but also in a sentential sense to convey semantic rather than
structural information. Correctly classifying cue phrases as discourse or
sentential is critical in natural language processing systems that exploit
discourse structure, e.g., for performing tasks such as anaphora resolution and
plan recognition. This paper explores the use of machine learning for
classifying cue phrases as discourse or sentential. Two machine learning
programs (Cgrendel and C4.5) are used to induce classification models from sets
of pre-classified cue phrases and their features in text and speech. Machine
learning is shown to be an effective technique for not only automating the
generation of classification models, but also for improving upon previous
results. When compared to manually derived classification models already in the
literature, the learned models often perform with higher accuracy and contain
new linguistic insights into the data. In addition, the ability to
automatically construct classification models makes it easier to comparatively
analyze the utility of alternative feature representations of the data.
Finally, the ease of retraining makes the learning approach more scalable and
flexible than manual methods.

    "
Computer Science > Artificial Intelligence;Learning First-Order Definitions of Functions;J. R. Quinlan;;;;;"  First-order learning involves finding a clause-form definition of a relation
from examples of the relation and relevant background information. In this
paper, a particular first-order learning system is modified to customize it for
finding definitions of functional relations. This restriction leads to faster
learning times and, in some cases, to definitions that have higher predictive
accuracy. Other first-order learning systems might benefit from similar
specialization.

    "
Computer Science > Artificial Intelligence;Characterizations of Decomposable Dependency Models;L. M. deCampos;;;;;"  Decomposable dependency models possess a number of interesting and useful
properties. This paper presents new characterizations of decomposable models in
terms of independence relationships, which are obtained by adding a single
axiom to the well-known set characterizing dependency models that are
isomorphic to undirected graphs. We also briefly discuss a potential
application of our results to the problem of learning graphical models from
data.

    "
Computer Science > Artificial Intelligence;Quantitative Results Comparing Three Intelligent Interfaces for Information Capture: A Case Study Adding Name Information into an Electronic Personal Organizer;J. C. Schlimmer;P. C. Wells;;;;"  Efficiently entering information into a computer is key to enjoying the
benefits of computing. This paper describes three intelligent user interfaces:
handwriting recognition, adaptive menus, and predictive fillin. In the context
of adding a personUs name and address to an electronic organizer, tests show
handwriting recognition is slower than typing on an on-screen, soft keyboard,
while adaptive menus and predictive fillin can be twice as fast. This paper
also presents strategies for applying these three interfaces to other
information collection domains.

    "
Computer Science > Artificial Intelligence;MUSE CSP: An Extension to the Constraint Satisfaction Problem;R. A Helzerman;M. P. Harper;;;;"  This paper describes an extension to the constraint satisfaction problem
(CSP) called MUSE CSP (MUltiply SEgmented Constraint Satisfaction Problem).
This extension is especially useful for those problems which segment into
multiple sets of partially shared variables. Such problems arise naturally in
signal processing applications including computer vision, speech processing,
and handwriting recognition. For these applications, it is often difficult to
segment the data in only one way given the low-level information utilized by
the segmentation algorithms. MUSE CSP can be used to compactly represent
several similar instances of the constraint satisfaction problem. If multiple
instances of a CSP have some common variables which have the same domains and
constraints, then they can be combined into a single instance of a MUSE CSP,
reducing the work required to apply the constraints. We introduce the concepts
of MUSE node consistency, MUSE arc consistency, and MUSE path consistency. We
then demonstrate how MUSE CSP can be used to compactly represent lexically
ambiguous sentences and the multiple sentence hypotheses that are often
generated by speech recognition algorithms so that grammar constraints can be
used to provide parses for all syntactically correct sentences. Algorithms for
MUSE arc and path consistency are provided. Finally, we discuss how to create a
MUSE CSP from a set of CSPs which are labeled to indicate when the same
variable is shared by more than a single CSP.

    "
Computer Science > Artificial Intelligence;Exploiting Causal Independence in Bayesian Network Inference;N. L. Zhang;D. Poole;;;;"  A new method is proposed for exploiting causal independencies in exact
Bayesian network inference. A Bayesian network can be viewed as representing a
factorization of a joint probability into the multiplication of a set of
conditional probabilities. We present a notion of causal independence that
enables one to further factorize the conditional probabilities into a
combination of even smaller factors and consequently obtain a finer-grain
factorization of the joint probability. The new formulation of causal
independence lets us specify the conditional probability of a variable given
its parents in terms of an associative and commutative operator, such as
``or'', ``sum'' or ``max'', on the contribution of each parent. We start with a
simple algorithm VE for Bayesian network inference that, given evidence and a
query variable, uses the factorization to find the posterior distribution of
the query. We show how this algorithm can be extended to exploit causal
independence. Empirical studies, based on the CPCS networks for medical
diagnosis, show that this method is more efficient than previous methods and
allows for inference in larger networks than previous algorithms.

    "
Computer Science > Artificial Intelligence;Adaptive Problem-solving for Large-scale Scheduling Problems: A Case Study;J. Gratch;S. Chien;;;;"  Although most scheduling problems are NP-hard, domain specific techniques
perform well in practice but are quite expensive to construct. In adaptive
problem-solving solving, domain specific knowledge is acquired automatically
for a general problem solver with a flexible control architecture. In this
approach, a learning system explores a space of possible heuristic methods for
one well-suited to the eccentricities of the given domain and problem
distribution. In this article, we discuss an application of the approach to
scheduling satellite communications. Using problem distributions based on
actual mission requirements, our approach identifies strategies that not only
decrease the amount of CPU time required to produce schedules, but also
increase the percentage of problems that are solvable within computational
resource limitations.

    "
Computer Science > Artificial Intelligence;Accelerating Partial-Order Planners: Some Techniques for Effective Search Control and Pruning;A. Gerevini;L. Schubert;;;;"  We propose some domain-independent techniques for bringing well-founded
partial-order planners closer to practicality. The first two techniques are
aimed at improving search control while keeping overhead costs low. One is
based on a simple adjustment to the default A* heuristic used by UCPOP to
select plans for refinement. The other is based on preferring ``zero
commitment'' (forced) plan refinements whenever possible, and using LIFO
prioritization otherwise. A more radical technique is the use of operator
parameter domains to prune search. These domains are initially computed from
the definitions of the operators and the initial and goal conditions, using a
polynomial-time algorithm that propagates sets of constants through the
operator graph, starting in the initial conditions. During planning, parameter
domains can be used to prune nonviable operator instances and to remove
spurious clobbering threats. In experiments based on modifications of UCPOP,
our improved plan and goal selection strategies gave speedups by factors
ranging from 5 to more than 1000 for a variety of problems that are nontrivial
for the unmodified version. Crucially, the hardest problems gave the greatest
improvements. The pruning technique based on parameter domains often gave
speedups by an order of magnitude or more for difficult problems, both with the
default UCPOP search strategy and with our improved strategy. The Lisp code for
our techniques and for the test problems is provided in on-line appendices.

    "
Computer Science > Artificial Intelligence;Mechanisms for Automated Negotiation in State Oriented Domains;G. Zlotkin;J. S. Rosenschein;;;;"  This paper lays part of the groundwork for a domain theory of negotiation,
that is, a way of classifying interactions so that it is clear, given a domain,
which negotiation mechanisms and strategies are appropriate. We define State
Oriented Domains, a general category of interaction. Necessary and sufficient
conditions for cooperation are outlined. We use the notion of worth in an
altered definition of utility, thus enabling agreements in a wider class of
joint-goal reachable situations. An approach is offered for conflict
resolution, and it is shown that even in a conflict situation, partial
cooperative steps can be taken by interacting agents (that is, agents in
fundamental conflict might still agree to cooperate up to a certain point). A
Unified Negotiation Protocol (UNP) is developed that can be used in all types
of encounters. It is shown that in certain borderline cooperative situations, a
partial cooperative agreement (i.e., one that does not achieve all agents'
goals) might be preferred by all agents, even though there exists a rational
agreement that would achieve all their goals. Finally, we analyze cases where
agents have incomplete information on the goals and worth of other agents.
First we consider the case where agents' goals are private information, and we
analyze what goal declaration strategies the agents might adopt to increase
their utility. Then, we consider the situation where the agents' goals (and
therefore stand-alone costs) are common knowledge, but the worth they attach to
their goals is private information. We introduce two mechanisms, one 'strict',
the other 'tolerant', and analyze their affects on the stability and efficiency
of negotiation outcomes.

    "
Computer Science > Artificial Intelligence;Reinforcement Learning: A Survey;L. P. Kaelbling;M. L. Littman;A. W. Moore;;;"  This paper surveys the field of reinforcement learning from a
computer-science perspective. It is written to be accessible to researchers
familiar with machine learning. Both the historical basis of the field and a
broad selection of current work are summarized. Reinforcement learning is the
problem faced by an agent that learns behavior through trial-and-error
interactions with a dynamic environment. The work described here has a
resemblance to work in psychology, but differs considerably in the details and
in the use of the word ``reinforcement.'' The paper discusses central issues of
reinforcement learning, including trading off exploration and exploitation,
establishing the foundations of the field via Markov decision theory, learning
from delayed reinforcement, constructing empirical models to accelerate
learning, making use of generalization and hierarchy, and coping with hidden
state. It concludes with a survey of some implemented systems and an assessment
of the practical utility of current methods for reinforcement learning.

    "
Computer Science > Artificial Intelligence;Least Generalizations and Greatest Specializations of Sets of Clauses;S. H. Nienhuys-Cheng;R. deWolf;;;;"  The main operations in Inductive Logic Programming (ILP) are generalization
and specialization, which only make sense in a generality order. In ILP, the
three most important generality orders are subsumption, implication and
implication relative to background knowledge. The two languages used most often
are languages of clauses and languages of only Horn clauses. This gives a total
of six different ordered languages. In this paper, we give a systematic
treatment of the existence or non-existence of least generalizations and
greatest specializations of finite sets of clauses in each of these six ordered
sets. We survey results already obtained by others and also contribute some
answers of our own. Our main new results are, firstly, the existence of a
computable least generalization under implication of every finite set of
clauses containing at least one non-tautologous function-free clause (among
other, not necessarily function-free clauses). Secondly, we show that such a
least generalization need not exist under relative implication, not even if
both the set that is to be generalized and the background knowledge are
function-free. Thirdly, we give a complete discussion of existence and
non-existence of greatest specializations in each of the six ordered languages.

    "
Computer Science > Artificial Intelligence;Further Experimental Evidence against the Utility of Occam's Razor;G. I. Webb;;;;;"  This paper presents new experimental evidence against the utility of Occam's
razor. A~systematic procedure is presented for post-processing decision trees
produced by C4.5. This procedure was derived by rejecting Occam's razor and
instead attending to the assumption that similar objects are likely to belong
to the same class. It increases a decision tree's complexity without altering
the performance of that tree on the training data from which it is inferred.
The resulting more complex decision trees are demonstrated to have, on average,
for a variety of common learning tasks, higher predictive accuracy than the
less complex original decision trees. This result raises considerable doubt
about the utility of Occam's razor as it is commonly applied in modern machine
learning.

    "
Computer Science > Artificial Intelligence;Practical Methods for Proving Termination of General Logic Programs;E. Marchiori;;;;;"  Termination of logic programs with negated body atoms (here called general
logic programs) is an important topic. One reason is that many computational
mechanisms used to process negated atoms, like Clark's negation as failure and
Chan's constructive negation, are based on termination conditions. This paper
introduces a methodology for proving termination of general logic programs
w.r.t. the Prolog selection rule. The idea is to distinguish parts of the
program depending on whether or not their termination depends on the selection
rule. To this end, the notions of low-, weakly up-, and up-acceptable program
are introduced. We use these notions to develop a methodology for proving
termination of general logic programs, and show how interesting problems in
non-monotonic reasoning can be formalized and implemented by means of
terminating general logic programs.

    "
Computer Science > Artificial Intelligence;A Divergence Critic for Inductive Proof;T. Walsh;;;;;"  Inductive theorem provers often diverge. This paper describes a simple
critic, a computer program which monitors the construction of inductive proofs
attempting to identify diverging proof attempts. Divergence is recognized by
means of a ``difference matching'' procedure. The critic then proposes lemmas
and generalizations which ``ripple'' these differences away so that the proof
can go through without divergence. The critic enables the theorem prover Spike
to prove many theorems completely automatically from the definitions alone.

    "
Computer Science > Artificial Intelligence;Improved Use of Continuous Attributes in C4.5;J. R. Quinlan;;;;;"  A reported weakness of C4.5 in domains with continuous attributes is
addressed by modifying the formation and evaluation of tests on continuous
attributes. An MDL-inspired penalty is applied to such tests, eliminating some
of them from consideration and altering the relative desirability of all tests.
Empirical trials show that the modifications lead to smaller decision trees
with higher predictive accuracies. Results also confirm that a new version of
C4.5 incorporating these changes is superior to recent approaches that use
global discretization and that construct small trees with multi-interval
splits.

    "
Computer Science > Artificial Intelligence;Active Learning with Statistical Models;D. A. Cohn;Z. Ghahramani;M. I. Jordan;;;"  For many types of machine learning algorithms, one can compute the
statistically `optimal' way to select training data. In this paper, we review
how optimal data selection techniques have been used with feedforward neural
networks. We then show how the same principles may be used to select data for
two alternative, statistically-based learning architectures: mixtures of
Gaussians and locally weighted regression. While the techniques for neural
networks are computationally expensive and approximate, the techniques for
mixtures of Gaussians and locally weighted regression are both efficient and
accurate. Empirically, we observe that the optimality criterion sharply
decreases the number of training examples the learner needs in order to achieve
good performance.

    "
Computer Science > Artificial Intelligence;Mean Field Theory for Sigmoid Belief Networks;L. K. Saul;T. Jaakkola;M. I. Jordan;;;"  We develop a mean field theory for sigmoid belief networks based on ideas
from statistical mechanics. Our mean field theory provides a tractable
approximation to the true probability distribution in these networks; it also
yields a lower bound on the likelihood of evidence. We demonstrate the utility
of this framework on a benchmark problem in statistical pattern
recognition---the classification of handwritten digits.

    "
Computer Science > Artificial Intelligence;Quantum Computing and Phase Transitions in Combinatorial Search;T. Hogg;;;;;"  We introduce an algorithm for combinatorial search on quantum computers that
is capable of significantly concentrating amplitude into solutions for some NP
search problems, on average. This is done by exploiting the same aspects of
problem structure as used by classical backtrack methods to avoid unproductive
search choices. This quantum algorithm is much more likely to find solutions
than the simple direct use of quantum parallelism. Furthermore, empirical
evaluation on small problems shows this quantum algorithm displays the same
phase transition behavior, and at the same location, as seen in many previously
studied classical search methods. Specifically, difficult problem instances are
concentrated near the abrupt change from underconstrained to overconstrained
problems.

    "
Computer Science > Artificial Intelligence;Logarithmic-Time Updates and Queries in Probabilistic Networks;A. L. Delcher;A. J. Grove;S. Kasif;J. Pearl;;"  Traditional databases commonly support efficient query and update procedures
that operate in time which is sublinear in the size of the database. Our goal
in this paper is to take a first step toward dynamic reasoning in probabilistic
databases with comparable efficiency. We propose a dynamic data structure that
supports efficient algorithms for updating and querying singly connected
Bayesian networks. In the conventional algorithm, new evidence is absorbed in
O(1) time and queries are processed in time O(N), where N is the size of the
network. We propose an algorithm which, after a preprocessing phase, allows us
to answer queries in time O(log N) at the expense of O(log N) time per evidence
absorption. The usefulness of sub-linear processing time manifests itself in
applications requiring (near) real-time response over large probabilistic
databases. We briefly discuss a potential application of dynamic probabilistic
reasoning in computational biology.

    "
Computer Science > Artificial Intelligence;Well-Founded Semantics for Extended Logic Programs with Dynamic Preferences;G. Brewka;;;;;"  The paper describes an extension of well-founded semantics for logic programs
with two types of negation. In this extension information about preferences
between rules can be expressed in the logical language and derived dynamically.
This is achieved by using a reserved predicate symbol and a naming technique.
Conflicts among rules are resolved whenever possible on the basis of derived
preference information. The well-founded conclusions of prioritized logic
programs can be computed in polynomial time. A legal reasoning example
illustrates the usefulness of the approach.

    "
